{
  "schemaVersion": "scoremosaic-polyphonic-teacher-gold-synthetic-pilot-v1",
  "dataset": "OSSQ-OMR",
  "sourceRepository": "MALerLab/ossq-omr",
  "sourceCommitSha": "7a17e45cddc0b7064fc3a179b62caeb57595e993",
  "license": "CC0-1.0",
  "renderer": {
    "name": "MuseScore",
    "versionOutput": "MuseScore: Music Score Editor; Version 3.6.2; Build 3224f34",
    "releaseTag": "v3.6.2",
    "appImageSha256": "c59a41ee88bc7c565a939b9c73498ac0451bbd86574e95cb6e359302c1465290",
    "imageResolutionDpi": 150
  },
  "discoveryEvidence": {
    "workflowRunId": 34880978800,
    "workflowHeadSha": "e8dbcba04711e17dabdf7a158685f469d44d8f4e",
    "artifactId": 10362957231,
    "artifactZipSha256": "1b7c75ebefbf2af0bf043721ee96c42d58d1e69149f1b0ae4809f2ac839ed36f",
    "artifactRetentionDays": 14
  },
  "pilotCount": 5,
  "records": [
    {
      "pilotId": "ossq_13744399",
      "title": "Arriaga — String Quartet No.1 in D minor",
      "sourcePath": "scores/Arriaga,_Juan_Crisóstomo_de/String_Quartet_No.1_in_D_minor/sq13744399.musicxml",
      "symbolicGold": {"mediaType": "application/vnd.recordare.musicxml+xml", "sha256": "e24a5d843693a538896bbbece71130c6a2da66ced35779c4f5295e4893b9fd48", "byteSize": 5742094},
      "renderedEvidence": {"mediaType": "image/png", "page": 1, "sha256": "aaad0862b69b54909ced34bb6513b69b56b5d03038086d907f3e06c9d39c8b67", "byteSize": 177136},
      "rightsStatus": "CLEAR_CC0",
      "teacherVerificationStatus": "DRAFT",
      "evaluationEligibility": "REVIEW_REQUIRED",
      "countTowardTeacherGoldMinimum": false
    },
    {
      "pilotId": "ossq_7313978",
      "title": "Andrée — String Quartet in A major",
      "sourcePath": "scores/Andrée,_Elfrida/String_Quartet_in_A_major/sq7313978.musicxml",
      "symbolicGold": {"mediaType": "application/vnd.recordare.musicxml+xml", "sha256": "a12b23404b4d8d4516e084721298b923a3c1f5621fd84e479b351eee179e7649", "byteSize": 4423395},
      "renderedEvidence": {"mediaType": "image/png", "page": 1, "sha256": "5c192dcd3c1460b3f7bdb02a824dcefc1f45344ae1bf6461d28480022e6c0958", "byteSize": 188546},
      "rightsStatus": "CLEAR_CC0",
      "teacherVerificationStatus": "DRAFT",
      "evaluationEligibility": "REVIEW_REQUIRED",
      "countTowardTeacherGoldMinimum": false
    },
    {
      "pilotId": "ossq_7383977",
      "title": "Arriaga — String Quartet No.3 in E-flat Major",
      "sourcePath": "scores/Arriaga,_Juan_Crisóstomo_de/String_Quartet_No.3_in_E-flat_Major/sq7383977.musicxml",
      "symbolicGold": {"mediaType": "application/vnd.recordare.musicxml+xml", "sha256": "ae821554999bfc0cb70ad4651106f50b9879e227d44daedc97c0e48e8ddf8ea2", "byteSize": 6759894},
      "renderedEvidence": {"mediaType": "image/png", "page": 1, "sha256": "095fe471b012bf7d909f30c348ec48b123219bf64ff48d2049d827103549f6a4", "byteSize": 172542},
      "rightsStatus": "CLEAR_CC0",
      "teacherVerificationStatus": "DRAFT",
      "evaluationEligibility": "REVIEW_REQUIRED",
      "countTowardTeacherGoldMinimum": false
    },
    {
      "pilotId": "ossq_8071278",
      "title": "Beethoven — String Quartet No.1, Op.18 No.1",
      "sourcePath": "scores/Beethoven,_Ludwig_van/String_Quartet_No.1,_Op.18_No.1/sq8071278.musicxml",
      "symbolicGold": {"mediaType": "application/vnd.recordare.musicxml+xml", "sha256": "6350ea0668db7e4773423293df62507987442dc4b313ca0a38e61de92f5a4631", "byteSize": 6632551},
      "renderedEvidence": {"mediaType": "image/png", "page": 1, "sha256": "b87ea167199099d26f303f69d9590874faa22199fceaca18f07ef72693f1547d", "byteSize": 159664},
      "rightsStatus": "CLEAR_CC0",
      "teacherVerificationStatus": "DRAFT",
      "evaluationEligibility": "REVIEW_REQUIRED",
      "countTowardTeacherGoldMinimum": false
    },
    {
      "pilotId": "ossq_8454356",
      "title": "Boccherini — String Quartet in A major, G.213 (Op.39)",
      "sourcePath": "scores/Boccherini,_Luigi/String_Quartet_in_A_major,_G.213_(Op.39)/sq8454356.musicxml",
      "symbolicGold": {"mediaType": "application/vnd.recordare.musicxml+xml", "sha256": "bd04cdd017a1e098e358cf9515253c7d7adf473f06e9087e642e55a820636243", "byteSize": 3447637},
      "renderedEvidence": {"mediaType": "image/png", "page": 1, "sha256": "f62f0f98380494336fd89854890c7444b9af29e555a9244879e7fbe2cb6e4499", "byteSize": 201595},
      "rightsStatus": "CLEAR_CC0",
      "teacherVerificationStatus": "DRAFT",
      "evaluationEligibility": "REVIEW_REQUIRED",
      "countTowardTeacherGoldMinimum": false
    }
  ],
  "boundaries": {
    "researchEvaluationOnly": true,
    "teacherVerified": false,
    "automaticFixtureAdmission": false,
    "automaticTrainingAuthorization": false,
    "productionDecisionAuthority": false
  }
}
